{
  "$schema": "https://json-schema.org/draft/2020-12/schema",
  "$id": "https://aurora-smart-home.dev/schemas/project-snapshot.schema.json",
  "title": "Aurora Project Snapshot",
  "description": "Hand-off artifact that travels between Aurora specialist agents during a multi-agent (DEEP mode) project. Written as a JSON file in the user's project directory (default: aurora-project.json at the project root). Each agent reads the snapshot, performs its work, then updates the snapshot before the next agent runs.",
  "type": "object",
  "required": [
    "schema_version",
    "project_id",
    "project_name",
    "created_at",
    "updated_at",
    "current_agent",
    "agents_completed",
    "agents_pending",
    "user_requirements",
    "validation_results"
  ],
  "properties": {
    "schema_version": {
      "type": "string",
      "pattern": "^\\d+\\.\\d+(\\.\\d+)?$",
      "description": "Snapshot schema version. Major bump = breaking change."
    },
    "project_id": {
      "type": "string",
      "format": "uuid",
      "description": "Stable UUID v4 generated by the orchestrator (aurora SKILL.md) when the snapshot is first created."
    },
    "project_name": {
      "type": "string",
      "minLength": 1,
      "description": "Short human-readable name (e.g. 'Living room sensor')."
    },
    "created_at": {
      "type": "string",
      "format": "date-time",
      "description": "ISO 8601 timestamp of snapshot creation."
    },
    "updated_at": {
      "type": "string",
      "format": "date-time",
      "description": "ISO 8601 timestamp of the most recent agent update."
    },
    "snapshot_file_path": {
      "type": ["string", "null"],
      "description": "Path (relative to project root, or absolute) where the snapshot file lives on disk. Optional informational field."
    },
    "current_agent": {
      "type": "string",
      "pattern": "^[a-z][a-z0-9-]*$",
      "description": "Soul name of the agent currently holding the snapshot (e.g. 'volt', 'sage', 'iris'). The orchestrator sets this before invoking the agent."
    },
    "agents_completed": {
      "type": "array",
      "items": {
        "type": "string",
        "pattern": "^[a-z][a-z0-9-]*$"
      },
      "description": "Ordered list of soul names that have finished their work. Each agent appends itself when done."
    },
    "agents_pending": {
      "type": "array",
      "items": {
        "type": "string",
        "pattern": "^[a-z][a-z0-9-]*$"
      },
      "description": "Ordered list of soul names that still need to run. The orchestrator computes this from the project plan."
    },
    "user_requirements": {
      "type": "array",
      "items": {"type": "string", "minLength": 1},
      "minItems": 1,
      "description": "Free-form list of what the user asked for, in their own words. Carried verbatim so downstream agents see the original intent, not Volt's translation of it."
    },
    "selected_board": {
      "type": ["string", "null"],
      "pattern": "^[a-z0-9][a-z0-9-]*$",
      "description": "board_id matching a profile under aurora/references/boards/. Null if the project does not involve ESPHome hardware."
    },
    "selected_components": {
      "type": "array",
      "items": {
        "type": "string",
        "pattern": "^[a-z0-9][a-z0-9-]*$"
      },
      "description": "List of component_id values matching profiles under aurora/references/components/."
    },
    "gpio_allocation": {
      "type": "object",
      "additionalProperties": {
        "type": "object",
        "additionalProperties": {
          "oneOf": [
            {"type": "integer", "minimum": 0, "maximum": 64},
            {"type": "array", "items": {"type": "integer", "minimum": 0, "maximum": 64}}
          ]
        }
      },
      "description": "Mapping of component_id → role → GPIO number(s). Example: {'bme280': {'sda': 8, 'scl': 9}, 'ld2410': {'tx': 4, 'rx': 5}}."
    },
    "entity_ids_generated": {
      "type": "array",
      "items": {
        "type": "string",
        "pattern": "^[a-z_]+\\.[a-z0-9_]+$"
      },
      "description": "Home Assistant entity IDs produced by upstream agents (e.g. sensor.living_room_temperature). Sage uses this list when wiring automations; Iris uses it for dashboards."
    },
    "esphome_filename": {
      "type": ["string", "null"],
      "pattern": "^[a-z0-9][a-z0-9-]*\\.yaml$",
      "description": "Filename Volt wrote the ESPHome config to, if any."
    },
    "ha_yaml_files": {
      "type": "array",
      "items": {"type": "string", "minLength": 1},
      "description": "Paths (relative to the HA config dir) that Sage produced or modified, e.g. automations.yaml, scripts.yaml."
    },
    "validation_results": {
      "type": "object",
      "additionalProperties": {
        "type": "object",
        "required": ["status"],
        "properties": {
          "status": {
            "type": "string",
            "enum": ["pending", "passed", "failed", "skipped", "warning"]
          },
          "validators_run": {
            "type": "array",
            "items": {"type": "string", "minLength": 1},
            "description": "Names of validator modules invoked (e.g. 'pin-validator', 'conflict-validator')."
          },
          "failures": {
            "type": "array",
            "items": {"type": "string", "minLength": 1},
            "description": "Failure messages produced by validators. Empty if status is passed."
          },
          "warnings": {
            "type": "array",
            "items": {"type": "string", "minLength": 1}
          },
          "completed_at": {
            "type": ["string", "null"],
            "format": "date-time"
          }
        }
      },
      "description": "Per-agent validation outcome. Key is the agent's soul name (e.g. 'volt'). Pending until the agent runs; passed/failed once it has."
    },
    "conflict_log": {
      "type": "array",
      "items": {
        "type": "object",
        "required": ["raised_by", "blocks_agent", "message", "raised_at"],
        "properties": {
          "raised_by": {
            "type": "string",
            "pattern": "^[a-z][a-z0-9-]*$",
            "description": "Soul name of the agent (or human reviewer) that flagged the conflict."
          },
          "blocks_agent": {
            "type": "string",
            "pattern": "^[a-z][a-z0-9-]*$",
            "description": "Soul name of the agent whose work cannot proceed until resolved."
          },
          "message": {
            "type": "string",
            "minLength": 1
          },
          "raised_at": {
            "type": "string",
            "format": "date-time"
          },
          "resolution": {
            "type": ["string", "null"],
            "description": "How the conflict was resolved. Null until resolved."
          },
          "resolved_at": {
            "type": ["string", "null"],
            "format": "date-time"
          }
        }
      },
      "description": "Open and resolved conflicts between agents. A non-empty list with unresolved entries blocks DEEP mode from completing."
    },
    "notes": {
      "type": "array",
      "items": {
        "type": "object",
        "required": ["author", "text", "added_at"],
        "properties": {
          "author": {"type": "string", "minLength": 1},
          "text": {"type": "string", "minLength": 1},
          "added_at": {"type": "string", "format": "date-time"}
        }
      },
      "description": "Free-form notes added by agents or the orchestrator. Used for context that does not fit a structured field."
    }
  },
  "additionalProperties": false
}
